{
  "schema_version": "0.1",
  "event_id": "guardrail_public_example_1",
  "policy_id": "policy_public_example_1",
  "stage": "pre_authority",
  "status": "passed",
  "started_at": "2026-07-09T16:00:02Z",
  "ended_at": "2026-07-09T16:00:03Z",
  "duration_ms": 750,
  "guardrail_name": "metadata_leakage_check",
  "masked_entity_counts": {
    "email": 1,
    "host_path": 0
  },
  "intervention_type": "none"
}
